conflict,"As far as the service goes, the waitresses were not particularly friendly, but they got the job done."
negative,"They are not helpful in the least and will give you the grand run around so by the time the event date rolls around you will not only regret chosing this place, but also become hostile!"
negative,I had to ask her three times before she finally came back with the dish Ive requested.
negative,"Staffs are not that friendly, but the taste covers all."
negative,Much of the time it seems like they do not care about you.
positive,The waiter was attentive.
positive,"Their sake list was extensive, but we were looking for Purple Haze, which wasn't listed but made for us upon request!"
positive,We went around 9:30 on a Friday and it had died down a bit by then so the service was great!
positive,"The food is consistently wonderful - I've been coming here for years, and the owner has always been accomodating and friendly."
negative,The waiters and owners were nonchalant about this and promised to call the exterminator but weren't as dismayed or apologetic as I would have expected.
positive,"They're also friendlier here, especially the owner, Kenny."
positive,Winnie and her staff are the best crew you can find serving you.
neutral,"My host asked for appetizers for the group and the waiter gave us not only what we ordered, but some other items that were not ordered."
positive,You can even get packages of the chutneys to stock your fridge!
positive,"If it isn't for the food (A+++), it must be the service or the ambience."
negative,"During the course of the past 3 months, the chef and staff changed and it was not for the better."
conflict,"Service was slow, but the people were friendly."
positive,"The staff makes you feel at home, the food is great and the atmosphere is WONDERFUL!"
negative,The staff was too busy ordering sushi for dinner and then laying it out to eat on the bar to even bring me my check.
conflict,"The staff has been nice, but they seemed really stressed and the unisex bathroom needs to be cleaned more often."
positive,The service was the only thing good about this restaurant.
positive,Service- friendly and attentive.
positive,Service was very prompt but slightly rushed.
positive,"Great food, great decor, great service."
negative,"And, atlhough tables opened up next to us and we ASKED for a slightly larger space, they left us awkardly seated."
negative,"Yeah, sometimes the service can be slow."
positive,The service was attentive without being overbearing and each dish we tried was wonderful from the spring rolls to the cod with pineapple tempura.
negative,They never came back to refill our glasses again.
positive,"The place is small and intimate and you may feel a little crowded, but the service is excellent and it's great for friends out, a romantic date, or a special occassion."
positive,The service was excellent and the food was delicious.
positive,Service was also very good.
negative,"They're rude at times, and not very friendly."
negative,"The sushi has been from average to below average, the wait service has always been sub-par the atmosphere goes from nice to really irritating (if you sit in the area beyond the kitchen, the acousitcs are horrid, everything echoes is extremely loud)."
negative,but the service was a bit slow.
negative,No one asked what was wrong as we left with nothing touched on our plates.
positive,We had a 3 hour brunch- they definitely do not rush you- and they kept the unlimited mimosas flowing the whole time.
negative,And their prices are very high - they actually think that they can get away with charging such prices for such terrible food and service!
positive,"The service was excellent, the food was excellent, but the entire experience was very cool."
positive,The service is good and the resturant is clean.
negative,"The cafe itself was really nice with comfortable outdoor chairs and tables, but the service could have been better."
positive,I've rarely had a problem with slow staff in the 10 years I've been going.
positive,I highly recommend Caviar Russe to anyone who wants delicious top grade caviar and fantastic service.
positive,"Plus, when our entrees were held up in the kitchen on a busy Saturday night, the owner sent over complimentary summer rolls to hold us over!"
positive,The service was great as well.
positive,From the moment we walked in they were more than accomodating even though the place was packed.
positive,"I found the food, service and value exceptional everytime I have been there."
negative,"The drinks are a saving grace, but service staff, please, get over yourselves."
negative,There is a downside if you're ordering in -- the delivery guys have MAJOR attitude.
positive,The all-Italian staff is warm and engaging from the start.
positive,I had been a regular due to the consistently good food and ease of getting a table.
positive,"Complimentary stuff kept coming, and when the waiter saw me opening a gift, I received my dessert on a plate that had Happy Birthday written on it, with a candlevery nice touch, and attentive staff."
negative,"The food arrived 20 minutes after I called, cold and soggy."
neutral,"The one up front will smile and say What can I get for you, brother?"
negative,INCREDIBLY POOR SERVICE AN FOOD QUALITY AT EXORBITANT PRICES.
negative,Horrible food and Horrible service.
positive,They treated us well and the food was extremely fresh and well-prepared.
positive,"Volare virgins or weekly regulars, everyone gets treated the same and you can't ask for more than that when the service is this friendly."
negative,"The food came out wrong, the waiter was no where to be found and the wine showed up at the end of the meal."
positive,The food was great and the service was even better.
negative,We were seated and ignored by waitstaff.
negative,They showed up 15 minutes after the tuna melt.
positive,I'd highly recommend it for a special occasion -- it provides and intimate setting and nice service.
negative,"they did give a 15% discount at the end, wasn't enough, as they knew the service was horrible."
negative,"however, it's the service that leaves a bad taste in my mouth."
negative,"When we notified him that he didn't mention the specials, he didn't apologize but let us know that we made a very good decision regardless."
positive,Kenny the owner is always there and he treats my family like we are part of his family.
positive,"Delicious food, excellent service, and a pretty atmosphere make this a great choice for dinner and the $5.99 lunch buffet makes it an even better choice for lunch!"
positive,Such nice people working here - but I have to review the food.
neutral,"The service was mediocre, and the lack of air conditioning made for a less than comfortable meal."
positive,The food and staff always surprise me with the new heights they are taken to.
positive,I've always been seated propmtly.
positive,"Ask for Usha, the nicest bartender in manhattan."
positive,The service is outstanding and my crab-cake eggs benedict could not have been better.
positive,"They treat me like family, morning and night."
conflict,Service was on par but not wonderful.
negative,Deliveries often take up to an hour and the prices are higher than most other pizzerias in the area.
negative,We were then shooed inside.
negative,"A gentleman, maybe the manager, came to our table, and without so much as a smile or greeting asked for our order."
negative,"In fact, it appears he is going to go postal at any moment."
negative,We were told that they were booked solid and no other table was available.
negative,"To my right, the hostess stood over a busboy and hissed rapido, rapido as he tried to clear and re-set a table for six."
negative,Our first greeting when we entered was The last call is at 10:15.
negative,"Note that they do not serve beer, you must bring your own."
neutral,"The service was typical short-order, dinner type."
